{
  "$schema": "./architecture-debt.schema.json",
  "description": "Exact, temporary Phase 1 architecture debt. Every entry must be removed in its owning later phase; new entries require an explicit architecture decision.",
  "legacy_paths": {
    "02-irc-core-bootstrap": [],
    "03-protocol-adapters": [],
    "04-nickserv": [],
    "05-memoserv": [],
    "06-chanserv": [
      "src/Application/Helper/SecureToken.php",
      "src/Application/Mail/MailerInterface.php",
      "src/Application/Mail/Message/SendEmail.php",
      "src/Application/Mail/Message/SendEmailHandler.php",
      "src/Application/Port/ActiveChannelModeSupportProviderInterface.php",
      "src/Application/Port/ApplyOutgoingChannelModesPort.php",
      "src/Application/Port/ChannelModeSupportInterface.php",
      "src/Application/Port/ChannelServiceActionsPort.php",
      "src/Application/Port/ChannelSyncCompletedRegistryInterface.php",
      "src/Application/Port/TransactionManagerInterface.php",
      "src/Application/Port/UidResolverInterface.php",
      "src/Infrastructure/IRC/ServiceBridge/ActiveChannelModeSupportProvider.php",
      "src/Infrastructure/IRC/ServiceBridge/CoreApplyOutgoingChannelModesAdapter.php",
      "src/Infrastructure/IRC/Subscriber/DebugChannelJoinSubscriber.php",
      "src/Infrastructure/Mail/SymfonyMailerAdapter.php",
      "src/Infrastructure/Messenger/Middleware/EmailDelayMiddleware.php",
      "src/Infrastructure/Persistence/DoctrineTransactionManager.php"
    ],
    "07-operserv-auth-audit": [
      "src/Application/Command/CommandOutcome.php",
      "src/Application/Command/IrcopAuditData.php",
      "src/Application/Command/IrcopAuditableCommandInterface.php",
      "src/Application/Event/CommandExecutedEvent.php",
      "src/Application/Maintenance/InMemoryPrunableInterface.php",
      "src/Application/Maintenance/MaintenanceScheduler.php",
      "src/Application/Maintenance/MaintenanceTaskInterface.php",
      "src/Application/Maintenance/Message/RunMaintenanceCycle.php",
      "src/Application/Maintenance/Message/RunMaintenanceCycleHandler.php",
      "src/Application/OperServ/ForcedVhostApplier.php",
      "src/Application/OperServ/IrcopAccessHelper.php",
      "src/Application/OperServ/IrcopAccessQueryService.php",
      "src/Application/OperServ/IrcopModeApplier.php",
      "src/Application/OperServ/IrcopOperclassApplier.php",
      "src/Application/OperServ/Maintenance/PurgeExpiredGlinesTask.php",
      "src/Application/OperServ/Maintenance/PurgeExpiredMotdsTask.php",
      "src/Application/OperServ/Port/In/IrcopAccessQuery.php",
      "src/Application/OperServ/Port/In/ProtectedNickQuery.php",
      "src/Application/OperServ/Port/Out/ServiceUserPreferences.php",
      "src/Application/OperServ/ProtectedNickQueryService.php",
      "src/Application/OperServ/RootUserRegistry.php",
      "src/Application/OperServ/Security/OperServIrcopPermission.php",
      "src/Application/OperServ/Service/PseudoClientUidGenerator.php",
      "src/Application/Port/ActiveConnectionHolderInterface.php",
      "src/Application/Port/AsyncMessageDispatcherInterface.php",
      "src/Application/Port/EventBusInterface.php",
      "src/Application/Port/OperclassServiceActionsInterface.php",
      "src/Application/Port/SendCtcpPort.php",
      "src/Application/Port/SendNoticePort.php",
      "src/Application/Port/ServiceChannelRegistrationPort.php",
      "src/Application/Port/ServiceCommandListenerInterface.php",
      "src/Application/Port/ServiceDebugNotifierInterface.php",
      "src/Application/Port/ServiceDebugNotifierRegistry.php",
      "src/Application/Port/ServiceUidProviderInterface.php",
      "src/Application/Port/TranslationInterface.php",
      "src/Application/Security/IrcopContextInterface.php",
      "src/Application/Security/PermissionProviderInterface.php",
      "src/Application/Security/PermissionRegistry.php",
      "src/Application/Services/Antiflood/AntifloodPruner.php",
      "src/Application/Services/Antiflood/AntifloodRegistry.php",
      "src/Application/Services/Antiflood/ClientKeyResolver.php",
      "src/Application/Shared/Help/HelpFormatterContextInterface.php",
      "src/Application/Shared/Help/HelpableCommandInterface.php",
      "src/Application/Shared/Help/UnifiedHelpFormatter.php",
      "src/Application/Shared/ServiceUidRegistry.php",
      "src/Domain/OperServ/Entity/Gline.php",
      "src/Domain/OperServ/Entity/Motd.php",
      "src/Domain/OperServ/Entity/OperIrcop.php",
      "src/Domain/OperServ/Entity/OperPermission.php",
      "src/Domain/OperServ/Entity/OperRole.php",
      "src/Domain/OperServ/Event/GlineRemovedEvent.php",
      "src/Domain/OperServ/Event/OperIrcopChangedEvent.php",
      "src/Domain/OperServ/Event/OperRoleForcedVhostChangedEvent.php",
      "src/Domain/OperServ/Exception/RoleProtectedException.php",
      "src/Domain/OperServ/Repository/GlineRepositoryInterface.php",
      "src/Domain/OperServ/Repository/MotdRepositoryInterface.php",
      "src/Domain/OperServ/Repository/OperIrcopRepositoryInterface.php",
      "src/Domain/OperServ/Repository/OperPermissionRepositoryInterface.php",
      "src/Domain/OperServ/Repository/OperRoleRepositoryInterface.php",
      "src/Domain/OperServ/ValueObject/ForcedVhost.php",
      "src/Domain/OperServ/ValueObject/GlobalMessageMask.php",
      "src/Infrastructure/Event/SymfonyEventBus.php",
      "src/Infrastructure/IRC/ServiceBridge/AntifloodSubscriber.php",
      "src/Infrastructure/IRC/ServiceBridge/CoreSendCtcpAdapter.php",
      "src/Infrastructure/IRC/ServiceBridge/CoreSendNoticeAdapter.php",
      "src/Infrastructure/IRC/ServiceBridge/CoreServiceChannelRegistrationAdapter.php",
      "src/Infrastructure/IRC/ServiceBridge/CtcpHandler.php",
      "src/Infrastructure/IRC/ServiceBridge/CtcpVersionResponder.php",
      "src/Infrastructure/IRC/ServiceBridge/ServiceCommandGateway.php",
      "src/Infrastructure/IRC/Subscriber/CommandExecutedAuditSubscriber.php",
      "src/Infrastructure/IRC/Subscriber/IrcopsDebugChannelProtectionSubscriber.php",
      "src/Infrastructure/Messenger/SymfonyAsyncMessageDispatcher.php",
      "src/Infrastructure/OperServ/Bot/OperServBot.php",
      "src/Infrastructure/OperServ/Doctrine/GlineDoctrineRepository.php",
      "src/Infrastructure/OperServ/Doctrine/MotdDoctrineRepository.php",
      "src/Infrastructure/OperServ/Doctrine/OperIrcopDoctrineRepository.php",
      "src/Infrastructure/OperServ/Doctrine/OperPermissionDoctrineRepository.php",
      "src/Infrastructure/OperServ/Doctrine/OperRoleDoctrineRepository.php",
      "src/Infrastructure/OperServ/User/NickServUserPreferencesAdapter.php",
      "src/Infrastructure/OperServ/Service/OperServDebugNotifier.php",
      "src/Infrastructure/OperServ/Subscriber/MotdOnConnectSubscriber.php",
      "src/Infrastructure/OperServ/Subscriber/OperRoleForcedVhostSubscriber.php",
      "src/Infrastructure/OperServ/Subscriber/OperRoleModesDeidentifiedSubscriber.php",
      "src/Infrastructure/OperServ/Subscriber/OperRoleModesSubscriber.php",
      "src/Infrastructure/OperServ/Subscriber/OperServCommandListener.php",
      "src/Infrastructure/OperServ/Subscriber/OperServGlineEnforceSubscriber.php",
      "src/Infrastructure/OperServ/Subscriber/OperServNickDropCleanupSubscriber.php",
      "src/Infrastructure/Security/Voter/IdentifiedVoter.php",
      "src/Infrastructure/Security/Voter/IrcopPermissionVoter.php",
      "src/Infrastructure/Security/Voter/RootVoter.php",
      "src/Infrastructure/Translation/SymfonyTranslationAdapter.php"
    ],
    "08-unreal-udb": [
      "src/Application/Port/NickChangePreservesIdentificationInterface.php",
      "src/Application/Port/PasswordMigrationStateInterface.php",
      "src/Application/Port/UdbMutation.php",
      "src/Application/Port/UdbOfflineTakeoverInterface.php",
      "src/Application/Port/UdbRawCommandHandlerInterface.php",
      "src/Application/Port/UdbRawCommandHandlerProviderInterface.php",
      "src/Application/Port/UdbRawCommandResult.php",
      "src/Application/Port/UdbRecordWriterInterface.php",
      "src/Domain/Udb/Entity/UdbAuthorityState.php",
      "src/Domain/Udb/Entity/UdbBlockState.php",
      "src/Domain/Udb/Entity/UdbRecord.php",
      "src/Domain/Udb/Repository/UdbAuthorityStateRepositoryInterface.php",
      "src/Domain/Udb/Repository/UdbBlockStateRepositoryInterface.php",
      "src/Domain/Udb/Repository/UdbRecordRepositoryInterface.php",
      "src/Infrastructure/IRC/Connection/ActiveUdbRawCommandHandlerProvider.php",
      "src/Infrastructure/IRC/Protocol/UnrealUdb/ParsedUdbPath.php",
      "src/Infrastructure/IRC/Protocol/UnrealUdb/Protocol/UdbBlock.php",
      "src/Infrastructure/IRC/Protocol/UnrealUdb/Protocol/UdbChecksum.php",
      "src/Infrastructure/IRC/Protocol/UnrealUdb/Protocol/UdbFrame.php",
      "src/Infrastructure/IRC/Protocol/UnrealUdb/Protocol/UdbFrameKind.php",
      "src/Infrastructure/IRC/Protocol/UnrealUdb/Protocol/UdbOclgViewDigest.php",
      "src/Infrastructure/IRC/Protocol/UnrealUdb/Protocol/UdbPathCodec.php",
      "src/Infrastructure/IRC/Protocol/UnrealUdb/Protocol/UdbSchema.php",
      "src/Infrastructure/IRC/Protocol/UnrealUdb/Protocol/UdbWireCodec.php",
      "src/Infrastructure/IRC/Protocol/UnrealUdb/Subscriber/UdbChannelSyncSubscriber.php",
      "src/Infrastructure/IRC/Protocol/UnrealUdb/Subscriber/UdbGlineSyncSubscriber.php",
      "src/Infrastructure/IRC/Protocol/UnrealUdb/Subscriber/UdbNickSyncSubscriber.php",
      "src/Infrastructure/IRC/Protocol/UnrealUdb/Subscriber/UdbPasswordRepairSubscriber.php",
      "src/Infrastructure/IRC/Protocol/UnrealUdb/UdbChannelModesFormatter.php",
      "src/Infrastructure/IRC/Protocol/UnrealUdb/UdbConnectionLifecycleSubscriber.php",
      "src/Infrastructure/IRC/Protocol/UnrealUdb/UdbFilePathStore.php",
      "src/Infrastructure/IRC/Protocol/UnrealUdb/UdbOclgView.php",
      "src/Infrastructure/IRC/Protocol/UnrealUdb/UdbOfflineTakeover.php",
      "src/Infrastructure/IRC/Protocol/UnrealUdb/UdbRecordExporter.php",